company,website,description
Stripe,stripe.com,Online payment processing for internet businesses
Notion,notion.so,All-in-one workspace for notes docs and project management
Figma,figma.com,Collaborative interface design tool for teams
Datadog,datadoghq.com,Cloud monitoring and security platform
Canva,canva.com,Online design and visual communication platform
Plaid,plaid.com,Financial data connectivity for fintech applications
Airtable,airtable.com,Low-code platform for building collaborative apps
Vercel,vercel.com,Frontend cloud platform for web developers
Cloudflare,cloudflare.com,Web infrastructure and security company
HubSpot,hubspot.com,CRM platform for marketing sales and customer service
Twilio,twilio.com,Cloud communications platform for developers
Snowflake,snowflake.com,Cloud data warehousing and analytics platform
MongoDB,mongodb.com,Document database platform for modern applications
Confluent,confluent.io,Data streaming platform built on Apache Kafka
Miro,miro.com,Online collaborative whiteboard platform for teams
